{
 "battery_family": "6S",
 "format": "bom-quad/1",
 "parts": [
  {
   "count": 4,
   "joint_type": "hip_roll",
   "part_id": "WD-R52-48",
   "role": "actuator"
  },
  {
   "count": 4,
   "joint_type": "hip_pitch",
   "part_id": "WD-R38-30",
   "role": "actuator"
  },
  {
   "count": 4,
   "joint_type": "knee",
   "part_id": "WD-R52-82",
   "role": "actuator"
  },
  {
   "count": 1,
   "part_id": "AC-6S-60",
   "role": "battery"
  },
  {
   "count": 6,
   "part_id": "TK-2C14",
   "role": "driver"
  },
  {
   "count": 1,
   "part_id": "TK-HB6",
   "role": "hub"
  }
 ],
 "total_cost_usd": 1367.0
}
